{
  "name": "cursor-plugins",
  "owner": {
    "name": "Cursor",
    "email": "plugins@cursor.com"
  },
  "metadata": {
    "description": "Cursor plugins for oh-my-pi"
  },
  "plugins": [
    {
      "name": "teaching",
      "source": "./teaching",
      "description": "Skill mapping, practice plans, and learning retrospectives.",
      "category": "Developer Tools"
    },
    {
      "name": "continual-learning",
      "source": "./continual-learning",
      "description": "Incremental transcript-driven memory updates for AGENTS.md using high-signal bullet points only.",
      "category": "Developer Tools"
    },
    {
      "name": "cursor-team-kit",
      "source": "./cursor-team-kit",
      "description": "Internal team workflows used by Cursor developers for CI, code review, shipping, local automation, and verification.",
      "category": "Developer Tools"
    },
    {
      "name": "thermos",
      "source": "./thermos",
      "description": "Thermo-nuclear branch review: deep security/correctness audits, harsh code-quality rubrics, parallel subagents, thermos orchestration, and optional merge-ready PR flows.",
      "category": "Developer Tools"
    },
    {
      "name": "create-plugin",
      "source": "./create-plugin",
      "description": "Scaffold and validate new Cursor plugins.",
      "category": "Developer Tools"
    },
    {
      "name": "ralph-loop",
      "source": "./ralph-loop",
      "description": "Iterative self-referential AI loops using the Ralph Wiggum technique.",
      "category": "Developer Tools"
    },
    {
      "name": "agent-compatibility",
      "source": "./agent-compatibility",
      "description": "CLI-backed repo compatibility scans plus Cursor agents that audit startup, validation, and docs against reality.",
      "category": "Developer Tools"
    },
    {
      "name": "cli-for-agent",
      "source": "./cli-for-agent",
      "description": "Patterns for designing CLIs that coding agents can run reliably: flags, help with examples, pipelines, errors, idempotency, dry-run.",
      "category": "Developer Tools"
    },
    {
      "name": "pr-review-canvas",
      "source": "./pr-review-canvas",
      "description": "Render PR diffs as interactive Cursor Canvases organized for reviewer comprehension — groups changes by importance, separates boilerplate from core logic, and highlights tricky or unexpected code.",
      "category": "Developer Tools"
    },
    {
      "name": "docs-canvas",
      "source": "./docs-canvas",
      "description": "Render documentation — architecture notes, API references, runbooks, and codebase walkthroughs — as a navigable Cursor Canvas with sections, table of contents, diagrams, and cross-references.",
      "category": "Developer Tools"
    },
    {
      "name": "cursor-sdk",
      "source": "./cursor-sdk",
      "description": "Build apps, scripts, CI pipelines, and automations on top of the Cursor TypeScript SDK (@cursor/sdk) — runtime selection, auth, streaming, MCP, error handling, and ready-to-extend integration patterns.",
      "category": "Developer Tools"
    },
    {
      "name": "orchestrate",
      "source": "./orchestrate",
      "description": "Fan large tasks out across parallel Cursor cloud agents with planners, workers, verifiers, and structured handoffs.",
      "category": "Developer Tools"
    },
    {
      "name": "pstack",
      "source": "./pstack",
      "description": "if you want to go fast, go deep first. pstack helps you write less, but higher quality code. rigorous agent workflows you can parallelize with confidence.",
      "category": "Developer Tools"
    },
    {
      "name": "gmail",
      "source": "./gmail",
      "description": "Connect Cursor to Gmail via Google's remote MCP server — search, read, draft, label, and manage email.",
      "category": "Developer Tools"
    },
    {
      "name": "google-drive",
      "source": "./google-drive",
      "description": "Connect Cursor to Google Drive via Google's remote MCP server — search, read, create, share, and manage files.",
      "category": "Developer Tools"
    },
    {
      "name": "google-calendar",
      "source": "./google-calendar",
      "description": "Connect Cursor to Google Calendar via Google's remote MCP server — list calendars, search events, and create or update meetings.",
      "category": "Developer Tools"
    },
    {
      "name": "google-docs",
      "source": "./google-docs",
      "description": "Connect Cursor to Google Docs via Google's remote MCP server — read and update documents.",
      "category": "Developer Tools"
    },
    {
      "name": "google-sheets",
      "source": "./google-sheets",
      "description": "Connect Cursor to Google Sheets via Google's remote MCP server — read spreadsheets, update values and formulas.",
      "category": "Developer Tools"
    },
    {
      "name": "google-slides",
      "source": "./google-slides",
      "description": "Connect Cursor to Google Slides via Google's remote MCP server — read and update presentations.",
      "category": "Developer Tools"
    }
  ]
}
